{
  "kind": "measurement_bindings",
  "schemaVersion": "0.1.0",
  "id": "synthetic-measurements",
  "historyId": "profile-example",
  "observationId": "synthetic",
  "contextId": "synthetic-context",
  "acquisitionBindingsId": "synthetic-binding",
  "measurements": [
    {
      "measurementRef": "measurement:velocity",
      "observationProductRef": "product:raw",
      "channelId": "radar",
      "time": {
        "state": "known",
        "kind": "instant",
        "value": "2026-07-28T12:10:00Z",
        "timeScale": "UTC"
      }
    }
  ]
}
